{
  "schema_version": "one_shot_execution_gate.v1",
  "gate_id": "PMBOT-BATCH-001-one-shot-execution-gate",
  "target_batch_id": "PMBOT-BATCH-001",
  "approval_request_ref": "codex_auto/external_cli/approval/PMBOT-BATCH-001.approval_request.json",
  "approval_decision_ref": "codex_auto/external_cli/approval/PMBOT-BATCH-001.approval_decision.json",
  "approved_prompt_path": "codex_auto/prompts/PMBOT-BATCH-001.codex_prompt.txt",
  "command_preview_ref": "codex_auto/external_cli/plans/PMBOT-BATCH-001.command_preview.txt",
  "final_command_preview_path": "codex_auto/external_cli/one_shot/PMBOT-BATCH-001.final_command_preview.txt",
  "allowed_output_paths": [
    "pm_bot/paper/",
    "pm_bot/paper/tests/",
    "pm_bot/risk/",
    "pm_bot/risk/tests/",
    "pm_bot/accounting/",
    "pm_bot/accounting/tests/",
    "pm_bot/reports/",
    "pm_bot/reports/tests/",
    "pm_bot/postmortem/",
    "pm_bot/postmortem/tests/",
    "pm_bot/audit/",
    "pm_bot/audit/tests/",
    "docs/PM_BOT_SAFE_BACKLOG_V2.json",
    "docs/PM_BOT_STAGE_SUMMARY_V2.md"
  ],
  "forbidden_paths": [
    "scripts/dispatcher.py",
    "scripts/run_codex.py",
    "tasks/",
    "state/",
    "runtime/",
    "results/",
    "freeze/",
    "checkpoint/",
    "codex_auto/queue/",
    "codex_auto/approval/",
    "codex_auto/flocky_review/",
    "codex_auto/promotion/",
    "codex_auto/ready_promotion/",
    "codex_auto/external_cli/"
  ],
  "expected_tests": [
    "python -m pytest pm_bot\\paper\\tests pm_bot\\risk\\tests pm_bot\\accounting\\tests pm_bot\\reports\\tests pm_bot\\postmortem\\tests pm_bot\\audit\\tests -q",
    "local deterministic command checks for created modules",
    "safety scan for no network/API/wallet/private key/trading",
    "safety scan for no dispatcher/run_codex/runtime mutation"
  ],
  "max_files_changed": 24,
  "rollback_plan": "If validation fails, delete only newly created files under allowed_output_paths, do not touch runtime files, do not touch codex_auto governance or control files, preserve logs and reports where safe, and require Flocky validation before any next attempt.",
  "post_execution_flocky_validation_required": true,
  "execution_allowed_by_human": true,
  "execution_allowed_now": false,
  "external_codex_cli_allowed_now": false,
  "generated_prompt_execution_allowed_now": false,
  "runtime_wiring_allowed": false,
  "gate_status": "prepared_pending_manual_run",
  "safety_check": {
    "manual_run_only": true,
    "do_not_execute_from_this_script": true,
    "requires_final_human_confirmation": true,
    "post_execution_flocky_validation_required": true,
    "runtime_wiring_allowed": false,
    "network_allowed": false,
    "api_allowed": false,
    "wallet_allowed": false,
    "private_key_allowed": false,
    "trading_allowed": false,
    "live_api_allowed": false,
    "real_orders_allowed": false,
    "external_codex_cli_allowed_now": false,
    "generated_prompt_execution_allowed_now": false,
    "single_runtime_source_rule_preserved": true
  }
}
